{
  "$schema": "../design-pack.schema.json",
  "schemaVersion": 1,
  "id": "org.lokro.lunar",
  "name": "LOKRO Lunar",
  "version": "1.0.0",
  "author": "Jamie Milo Cürten with OpenAI Codex",
  "license": "CC-BY-SA-4.0",
  "description": "A light black-and-white halftone atmosphere with the LOKRO Mono cursor.",
  "plasma": {
    "lookAndFeel": "org.kde.breeze.desktop",
    "colorScheme": "BreezeLight",
    "cursorTheme": "LokroMono",
    "cursorSize": 24,
    "wallpaper": "payload/wallpapers/lokro-lunar.png"
  }
}
